{
    "schema_version":  "1.0.0",
    "use_case":  "UC4",
    "generator":  "salus-mathsim/0.1.0",
    "generated_at_utc":  "2026-09-11T11:31:49.337845Z",
    "hash_algorithm":  "SHA-256",
    "self_excluded":  true,
    "artifact_count":  398,
    "artifacts":  [
                      {
                          "path":  ".gitignore",
                          "bytes":  161,
                          "sha256":  "3a176f520bcd0c5265ee7c8b99214b122e41a337065635903484533090acab75"
                      },
                      {
                          "path":  "CHANGELOG.md",
                          "bytes":  1407,
                          "sha256":  "19d65fa79a6683c063bb778ecc97c4a6e8b2c2693b009c0f25f3fdc08c8b1822"
                      },
                      {
                          "path":  "README.md",
                          "bytes":  7826,
                          "sha256":  "028790efd37a0875e280cd911b821c5825ce22131021593e7dfcab6e8dd867f8"
                      },
                      {
                          "path":  "configs/uc4/baseline.yaml",
                          "bytes":  4317,
                          "sha256":  "da501a59bd653f669f3bbc2b29b08f8a2bd24a297f70f41c36ad769fd2390eca"
                      },
                      {
                          "path":  "configs/uc4/experiments.yaml",
                          "bytes":  5123,
                          "sha256":  "5c21a6ede2d8dad7ff83bbf81f20e83ce430f61d80833af2ca1fb13521c8bad3"
                      },
                      {
                          "path":  "configs/uc4/incident_lawful_access.yaml",
                          "bytes":  4123,
                          "sha256":  "0b12635262344c7dcae049d5e1f9ec69039d4d7cd938603145e575bd10fb77ce"
                      },
                      {
                          "path":  "configs/uc4/monte_carlo.yaml",
                          "bytes":  605,
                          "sha256":  "afbe120dce8792309980344ab6d51aefb5135a33264c8e1ee79abce58f8d9d6c"
                      },
                      {
                          "path":  "configs/uc4/schema_migrations.yaml",
                          "bytes":  345,
                          "sha256":  "26533b5bffa6a6d925a94196ef778e083e18fed3c9f8e90f38c965734d01cecd"
                      },
                      {
                          "path":  "configs/uc4/schema_version.yaml",
                          "bytes":  615,
                          "sha256":  "45a61eb6b2238b473c95f0f538970dd6816ea1caa7724c03440b082ad86ac844"
                      },
                      {
                          "path":  "contracts/integration/uc4_integration_contracts.yaml",
                          "bytes":  14004,
                          "sha256":  "d8136e84608254cded4a24b86a5719ba537a39b2fae962be30afb94e3be4601f"
                      },
                      {
                          "path":  "data/inventory/device_and_system_inventory.csv",
                          "bytes":  27006,
                          "sha256":  "8ca92711bc6811a59b2e222f30d371f3c553ba7d65ad84b18200bcc186fef514"
                      },
                      {
                          "path":  "data/inventory/device_inventory.csv",
                          "bytes":  6472,
                          "sha256":  "e15afeb4245e9d9a2a2e5431311cdace09e80a5d0adc95dca5eb24c076b87ad9"
                      },
                      {
                          "path":  "data/inventory/uc4_entity_inventory.csv",
                          "bytes":  17096,
                          "sha256":  "57fc92f21dbdea731e87f9b860897e517b4825683218981222cedea2f1e9d97f"
                      },
                      {
                          "path":  "data/inventory/uc4_legacy_cpe_field_mapping.csv",
                          "bytes":  8306,
                          "sha256":  "4c69c20270c233f40a5b00d92a6ca43f9e0acb4c42be34233a6fc8b07ce6c6bb"
                      },
                      {
                          "path":  "data/processed/uc4/README.md",
                          "bytes":  412,
                          "sha256":  "0c08d94a6f701b3f3004c712a8266c2fa2be364e676b7b17c6cd5bb62fa5860d"
                      },
                      {
                          "path":  "data/raw/uc4/README.md",
                          "bytes":  458,
                          "sha256":  "5384ae900a1429c9c0ee8c4d4a53983fe598fb23d6fde96dce2658639ca7a28e"
                      },
                      {
                          "path":  "data/synthetic/uc4/README.md",
                          "bytes":  387,
                          "sha256":  "b5d16cc680b3f8306a276738524b9b95bb78c75162921e434787b5487231b085"
                      },
                      {
                          "path":  "diagrams/entity_relationships/UC4.md",
                          "bytes":  749,
                          "sha256":  "2556385b0b3aa699d82503e3ad16ae3bb838f909506c5957eeffe2ae425fe5c6"
                      },
                      {
                          "path":  "diagrams/process_flows/UC4_detection_case_trigger.bpmn",
                          "bytes":  16308,
                          "sha256":  "1ea22c2b06484afae73777518c0d01be0dedb48e6ef6ce398f8645ded2feb9a5"
                      },
                      {
                          "path":  "diagrams/process_flows/UC4_evidence_investigation.bpmn",
                          "bytes":  24182,
                          "sha256":  "e873f163cef6faaaa961e89629826a5dff071a3d291fd6d4aa914132eedbf83c"
                      },
                      {
                          "path":  "diagrams/process_flows/UC4_incident.bpmn",
                          "bytes":  19135,
                          "sha256":  "0d38b5c2467d8f1bf5627e1390dfdae3ba36287303cee3d0c65ba098b22b9564"
                      },
                      {
                          "path":  "diagrams/process_flows/UC4_lawful_acquisition.bpmn",
                          "bytes":  29889,
                          "sha256":  "98cbb81808c2a0f349486489b92edef7149aa6dab13963c8402fc0df0f525efc"
                      },
                      {
                          "path":  "diagrams/process_flows/UC4_normal_operation.bpmn",
                          "bytes":  20234,
                          "sha256":  "aab4ff24f5ef9390eae3b688caff3833850828d09e72652816f26376468f94dc"
                      },
                      {
                          "path":  "diagrams/process_flows/UC4_system_collaboration.bpmn",
                          "bytes":  20326,
                          "sha256":  "26a0c48df3f40c16298e26efda25d41f76c7fe8a58324d37dd1d8e26e905856b"
                      },
                      {
                          "path":  "diagrams/state_machines/UC4_entity_lifecycles.bpmn",
                          "bytes":  69261,
                          "sha256":  "a91f8687a95f29405be779eeeac0ba9ad1cf4b80923fd901bc77706351488cb8"
                      },
                      {
                          "path":  "docs/00_task_scope.md",
                          "bytes":  58,
                          "sha256":  "69c8cbffeffffb2ec156e353dd472c7a09a6ccd2d6dfcf0d0736d027da566790"
                      },
                      {
                          "path":  "docs/01_use_case_analysis.md",
                          "bytes":  44,
                          "sha256":  "3e29118bab4d6efc40807d64d655cff329df4873dd889913003e442e160bef80"
                      },
                      {
                          "path":  "docs/02_entity_model.md",
                          "bytes":  8279,
                          "sha256":  "9ace32a2ba2d30c47df18c1e5df5213f2f53e98c4361776585979a1e6aa1d142"
                      },
                      {
                          "path":  "docs/03_process_model.md",
                          "bytes":  3279,
                          "sha256":  "6e354a9a12e3b8ed76c716b01ff632d9f436185f9f305c6bdb506a4f8e5e2ae9"
                      },
                      {
                          "path":  "docs/04_validation_plan.md",
                          "bytes":  5246,
                          "sha256":  "20615d40947ffc9cbeec4a7c025c31460285a25acf5962915ec03a37d35b1354"
                      },
                      {
                          "path":  "docs/05_integration_notes.md",
                          "bytes":  961,
                          "sha256":  "085d58b5c3b108f41fb94e92d0a5c6502d66ed83879a5688078b64b286b977c7"
                      },
                      {
                          "path":  "docs/analysis/UC4_metrics_and_sensitivity.md",
                          "bytes":  6049,
                          "sha256":  "eceb9172206b8bfb2fe272118f111495cefc4951ec5794aa1bd470216eb825a4"
                      },
                      {
                          "path":  "docs/assumptions/UC4_assumptions.md",
                          "bytes":  16525,
                          "sha256":  "10fc638dd6bb524f61655aec04f8522b22a99dc25d12e2afda93bcefe575c2ff"
                      },
                      {
                          "path":  "docs/graph/UC4_graph_queries.md",
                          "bytes":  4458,
                          "sha256":  "593c8db25518df12562e7ba7d160cbe92d6b56026fe661ef423f014ae8fb8657"
                      },
                      {
                          "path":  "docs/integration/UC4_integration_contracts.md",
                          "bytes":  4721,
                          "sha256":  "cbd9cbe1dda4931fa7aa7dbfb99e6e27f7d386deb8a3191e1def9599d7d50932"
                      },
                      {
                          "path":  "docs/packaging/DEPENDENCY_LOCK.md",
                          "bytes":  1717,
                          "sha256":  "6b05df17def0d240209267472001380bd86b48ae4c55a20618ffd22396d364a1"
                      },
                      {